[
  {
    "Campaign": "mb | DA | Search | Google Ads",
    "Ad Group": "Google Ads Bureau | Danmark",
    "Keyword": "google ads bureau",
    "Match Type": "Exact",
    "Final URL": "https://mondaybrew.dk/kundeflow/google-ads"
  },
  {
    "Campaign": "mb | DA | Search | Google Ads",
    "Ad Group": "Google Ads Bureau | Danmark",
    "Keyword": "adwords bureau",
    "Match Type": "Exact",
    "Final URL": "https://mondaybrew.dk/kundeflow/google-ads"
  },
  {
    "Campaign": "mb | DA | Search | Google Ads",
    "Ad Group": "Google Ads Bureau | Danmark",
    "Keyword": "google adwords bureau",
    "Match Type": "Exact",
    "Final URL": "https://mondaybrew.dk/kundeflow/google-ads"
  },
  {
    "Campaign": "mb | DA | Search | Google Ads",
    "Ad Group": "Google Ads Bureau | Danmark",
    "Keyword": "ads bureau",
    "Match Type": "Phrase",
    "Final URL": "https://mondaybrew.dk/kundeflow/google-ads"
  },
  {
    "Campaign": "mb | DA | Search | Google Ads",
    "Ad Group": "Google Ads Bureau | Danmark",
    "Keyword": "ppc bureau",
    "Match Type": "Exact",
    "Final URL": "https://mondaybrew.dk/kundeflow/google-ads"
  },
  {
    "Campaign": "mb | DA | Search | Google Ads",
    "Ad Group": "Google Annoncering | Danmark",
    "Keyword": "google annoncering",
    "Match Type": "Phrase",
    "Final URL": "https://mondaybrew.dk/kundeflow/google-ads"
  },
  {
    "Campaign": "mb | DA | Search | Google Ads",
    "Ad Group": "Google Annoncering | Danmark",
    "Keyword": "annoncering på google",
    "Match Type": "Phrase",
    "Final URL": "https://mondaybrew.dk/kundeflow/google-ads"
  },
  {
    "Campaign": "mb | DA | Search | Google Ads",
    "Ad Group": "Google Annoncering | Danmark",
    "Keyword": "google reklame",
    "Match Type": "Phrase",
    "Final URL": "https://mondaybrew.dk/kundeflow/google-ads"
  },
  {
    "Campaign": "mb | DA | Search | Google Ads",
    "Ad Group": "Google Annoncering | Danmark",
    "Keyword": "google annoncer",
    "Match Type": "Phrase",
    "Final URL": "https://mondaybrew.dk/kundeflow/google-ads"
  },
  {
    "Campaign": "mb | DA | Search | Google Ads",
    "Ad Group": "Google Annoncering | Danmark",
    "Keyword": "google ads optimering",
    "Match Type": "Exact",
    "Final URL": "https://mondaybrew.dk/kundeflow/google-ads"
  },
  {
    "Campaign": "mb | DA | Search | Lead Generation",
    "Ad Group": "Leadgenerering | Danmark",
    "Keyword": "leadgenerering",
    "Match Type": "Phrase",
    "Final URL": "https://mondaybrew.dk/kundeflow/leadgenerering"
  },
  {
    "Campaign": "mb | DA | Search | Lead Generation",
    "Ad Group": "Leadgenerering | Danmark",
    "Keyword": "lead generation",
    "Match Type": "Phrase",
    "Final URL": "https://mondaybrew.dk/kundeflow/leadgenerering"
  },
  {
    "Campaign": "mb | DA | Search | Lead Generation",
    "Ad Group": "Leadgenerering | Danmark",
    "Keyword": "lead generering",
    "Match Type": "Phrase",
    "Final URL": "https://mondaybrew.dk/kundeflow/leadgenerering"
  },
  {
    "Campaign": "mb | DA | Search | Lead Generation",
    "Ad Group": "Leadgenerering | Danmark",
    "Keyword": "online leadgenerering",
    "Match Type": "Exact",
    "Final URL": "https://mondaybrew.dk/kundeflow/leadgenerering"
  },
  {
    "Campaign": "mb | DA | Search | Lead Generation",
    "Ad Group": "B2B Leadgenerering | Danmark",
    "Keyword": "leadgenerering b2b",
    "Match Type": "Exact",
    "Final URL": "https://mondaybrew.dk/kundeflow/leadgenerering"
  },
  {
    "Campaign": "mb | DA | Search | Lead Generation",
    "Ad Group": "B2B Leadgenerering | Danmark",
    "Keyword": "b2b leadgenerering",
    "Match Type": "Exact",
    "Final URL": "https://mondaybrew.dk/kundeflow/leadgenerering"
  },
  {
    "Campaign": "mb | DA | Search | Lead Generation",
    "Ad Group": "B2B Leadgenerering | Danmark",
    "Keyword": "b2b leads",
    "Match Type": "Exact",
    "Final URL": "https://mondaybrew.dk/kundeflow/leadgenerering"
  },
  {
    "Campaign": "mb | DA | Search | Lead Generation",
    "Ad Group": "B2B Leadgenerering | Danmark",
    "Keyword": "digital leadgenerering",
    "Match Type": "Exact",
    "Final URL": "https://mondaybrew.dk/kundeflow/leadgenerering"
  },
  {
    "Campaign": "mb | DA | Search | Lead Generation",
    "Ad Group": "B2B Leadgenerering | Danmark",
    "Keyword": "få flere leads",
    "Match Type": "Exact",
    "Final URL": "https://mondaybrew.dk/kundeflow/leadgenerering"
  },
  {
    "Campaign": "mb | DA | Search | Digital Bureau",
    "Ad Group": "Marketing Bureau | Danmark",
    "Keyword": "marketing bureau",
    "Match Type": "Phrase",
    "Final URL": "https://mondaybrew.dk/"
  },
  {
    "Campaign": "mb | DA | Search | Digital Bureau",
    "Ad Group": "Marketing Bureau | Danmark",
    "Keyword": "digitalt marketing bureau",
    "Match Type": "Phrase",
    "Final URL": "https://mondaybrew.dk/"
  },
  {
    "Campaign": "mb | DA | Search | Digital Bureau",
    "Ad Group": "Marketing Bureau | Danmark",
    "Keyword": "digital markedsføring bureau",
    "Match Type": "Phrase",
    "Final URL": "https://mondaybrew.dk/"
  },
  {
    "Campaign": "mb | DA | Search | Digital Bureau",
    "Ad Group": "Marketing Bureau | Danmark",
    "Keyword": "markedsføring bureau",
    "Match Type": "Phrase",
    "Final URL": "https://mondaybrew.dk/"
  },
  {
    "Campaign": "mb | DA | Search | Digital Bureau",
    "Ad Group": "Digitalt Bureau | Danmark",
    "Keyword": "digitalt bureau",
    "Match Type": "Phrase",
    "Final URL": "https://mondaybrew.dk/"
  },
  {
    "Campaign": "mb | DA | Search | Digital Bureau",
    "Ad Group": "Digitalt Bureau | Danmark",
    "Keyword": "digital bureau",
    "Match Type": "Phrase",
    "Final URL": "https://mondaybrew.dk/"
  },
  {
    "Campaign": "mb | DA | Search | Digital Bureau",
    "Ad Group": "Digitalt Bureau | Danmark",
    "Keyword": "fullservice bureau",
    "Match Type": "Exact",
    "Final URL": "https://mondaybrew.dk/"
  },
  {
    "Campaign": "mb | DA | Search | Digital Bureau",
    "Ad Group": "Performance Bureau | Danmark",
    "Keyword": "performance marketing bureau",
    "Match Type": "Exact",
    "Final URL": "https://mondaybrew.dk/"
  },
  {
    "Campaign": "mb | DA | Search | Digital Bureau",
    "Ad Group": "Performance Bureau | Danmark",
    "Keyword": "marketing automation bureau",
    "Match Type": "Exact",
    "Final URL": "https://mondaybrew.dk/"
  },
  {
    "Campaign": "mb | DA | Search | Digital Bureau",
    "Ad Group": "Performance Bureau | Danmark",
    "Keyword": "online markedsføring bureau",
    "Match Type": "Exact",
    "Final URL": "https://mondaybrew.dk/"
  },
  {
    "Campaign": "mb | DA | Search | Digital Bureau",
    "Ad Group": "Performance Bureau | Danmark",
    "Keyword": "b2b content marketing bureau",
    "Match Type": "Exact",
    "Final URL": "https://mondaybrew.dk/"
  },
  {
    "Campaign": "mb | DA | Search | Meta Ads",
    "Ad Group": "Facebook Annoncering | Danmark",
    "Keyword": "facebook annoncering",
    "Match Type": "Phrase",
    "Final URL": "https://mondaybrew.dk/kundeflow/meta-ads"
  },
  {
    "Campaign": "mb | DA | Search | Meta Ads",
    "Ad Group": "Facebook Annoncering | Danmark",
    "Keyword": "annoncering på facebook",
    "Match Type": "Phrase",
    "Final URL": "https://mondaybrew.dk/kundeflow/meta-ads"
  },
  {
    "Campaign": "mb | DA | Search | Meta Ads",
    "Ad Group": "Facebook Annoncering | Danmark",
    "Keyword": "facebook annoncer",
    "Match Type": "Phrase",
    "Final URL": "https://mondaybrew.dk/kundeflow/meta-ads"
  },
  {
    "Campaign": "mb | DA | Search | Meta Ads",
    "Ad Group": "Facebook Annoncering | Danmark",
    "Keyword": "facebook markedsføring",
    "Match Type": "Phrase",
    "Final URL": "https://mondaybrew.dk/kundeflow/meta-ads"
  },
  {
    "Campaign": "mb | DA | Search | Meta Ads",
    "Ad Group": "Facebook Annoncering | Danmark",
    "Keyword": "facebook annoncering bureau",
    "Match Type": "Exact",
    "Final URL": "https://mondaybrew.dk/kundeflow/meta-ads"
  },
  {
    "Campaign": "mb | DA | Search | Meta Ads",
    "Ad Group": "Facebook Annoncering | Danmark",
    "Keyword": "hjælp til facebook annoncering",
    "Match Type": "Exact",
    "Final URL": "https://mondaybrew.dk/kundeflow/meta-ads"
  },
  {
    "Campaign": "mb | DA | Search | Meta Ads",
    "Ad Group": "Facebook Annoncering | Danmark",
    "Keyword": "facebook ads bureau",
    "Match Type": "Exact",
    "Final URL": "https://mondaybrew.dk/kundeflow/meta-ads"
  },
  {
    "Campaign": "mb | DA | Search | Meta Ads",
    "Ad Group": "Meta & Instagram | Danmark",
    "Keyword": "meta ads",
    "Match Type": "Phrase",
    "Final URL": "https://mondaybrew.dk/kundeflow/meta-ads"
  },
  {
    "Campaign": "mb | DA | Search | Meta Ads",
    "Ad Group": "Meta & Instagram | Danmark",
    "Keyword": "instagram annoncering",
    "Match Type": "Phrase",
    "Final URL": "https://mondaybrew.dk/kundeflow/meta-ads"
  },
  {
    "Campaign": "mb | DA | Search | Meta Ads",
    "Ad Group": "Meta & Instagram | Danmark",
    "Keyword": "meta annoncer",
    "Match Type": "Phrase",
    "Final URL": "https://mondaybrew.dk/kundeflow/meta-ads"
  },
  {
    "Campaign": "mb | DA | Search | Meta Ads",
    "Ad Group": "Meta & Instagram | Danmark",
    "Keyword": "markedsføring på sociale medier",
    "Match Type": "Phrase",
    "Final URL": "https://mondaybrew.dk/kundeflow/meta-ads"
  },
  {
    "Campaign": "mb | DA | Search | Websites",
    "Ad Group": "Webbureau | Danmark",
    "Keyword": "webbureau",
    "Match Type": "Phrase",
    "Final URL": "https://mondaybrew.dk/konvertering/websites"
  },
  {
    "Campaign": "mb | DA | Search | Websites",